<?xml version="1.0" encoding="UTF-8"?>
<!DOCTYPE opencms SYSTEM "http://www.opencms.org/dtd/6.0/opencms-sites.dtd">

<opencms>
	<sites>
		<workplace-server>http://localhost:8080</workplace-server>
		<default-uri>/sites/default/</default-uri>
		<shared-folder>/shared/</shared-folder>
		<site server="http://localhost:8080" uri="/sites/default/">
			<secure server="https://localhost:443" />
		</site>
		<site server="http://localhost:8081" uri="/sites/default/folder1/" />
		<site server="http://localhost:8082" uri="/sites/testsite/" />
	</sites>
</opencms>