<?xml version="1.0" encoding="UTF-8"?>
<!DOCTYPE opencms SYSTEM "http://www.opencms.org/dtd/6.0/opencms-sites.dtd">

<opencms>
	<sites>
		<workplace-server>http://localhost:8080</workplace-server>
		<default-uri>/sites/default/</default-uri>
		<shared-folder>/shared/</shared-folder>
		<site server="http://localhost:8080" uri="/sites/default/">
			<secure server="https://localhost:443" />
			<parameters>
				<param name="localizationMode">singleTree</param>
			</parameters>
		</site>
		<!-- If you add sites here, you also need to change the number of expected 
			sites in TestCmsSiteConfiguration. -->
		<site server="http://localhost:8081" uri="/sites/default/folder1/" />
		<site server="http://localhost:8082" uri="/sites/testsite/" />
		<site server="http://foo.org" uri="/sites/foo/" />
		<site server="http://bar.org" uri="/sites/bar/" />
	</sites>
</opencms>